<?xml version="1.0" encoding="UTF-8"?>
<xs:schema xmlns:xs="http://www.w3.org/2001/XMLSchema" elementFormDefault="qualified">
  <xs:element name="aws_regions">
    <xs:complexType>
      <xs:sequence>
        <xs:element maxOccurs="unbounded" ref="region"/>
      </xs:sequence>
    </xs:complexType>
  </xs:element>
  <xs:element name="region">
    <xs:complexType>
      <xs:attribute name="name" use="required" type="xs:NCName"/>
      <xs:attribute name="info" use="required" type="xs:string"/>
    </xs:complexType>
  </xs:element>
</xs:schema>
